SerialNo,Title,Ministry,Introduced,Passed_LS,Passed_RS
1,"The Indian Ports Bill, 2025","PORTS, SHIPPING & WATERWAYS",28/03/2025,,
2,"The Appropriation (No.3) Bill, 2025",FINANCE,21/03/2025,21/03/2025,27/03/2025
3,"The Immigration and Foreigners Bill, 2025",HOME AFFAIRS,11/03/2025,27/03/2025,02/04/2025
4,"The Appropriation Bill (No.2), 2025",FINANCE,11/03/2025,11/03/2025,18/03/2025
5,"The Appropriation Bill, 2025",FINANCE,11/03/2025,11/03/2025,18/03/2025
6,"Manipur Appropriation (Vote on Account) Bill, 2025",FINANCE,11/03/2025,11/03/2025,18/03/2025
7,"Manipur Appropriation Bill, 2025",FINANCE,11/03/2025,11/03/2025,18/03/2025
8,"The Income-Tax Bill, 2025",FINANCE,13/02/2025,,
9,"The Protection of Interests in Aircraft Objects Bill, 2025",CIVIL AVIATION,10/02/2025,03/04/2025,01/04/2025
10,"The Tribhuvan Sahkari University Bill,2025",COOPERATION,03/02/2025,26/03/2025,01/04/2025
11,"The Finance Bill, 2025",FINANCE,01/02/2025,25/03/2025,27/03/2025
12,"The Finance Bill, 2025",FINANCE,01/02/2025,25/03/2025,27/03/2025
13,"The Constitution (One Hundred and Twenty-Ninth Amendment) Bill, 2024",LAW  AND JUSTICE,17/12/2024,,
14,"The Union Territories Laws (Amendment) Bill, 2024",LAW  AND JUSTICE,17/12/2024,,
15,"The Appropriation (No.3) Bill, 2024",FINANCE,17/12/2024,17/12/2024,
16,"The Merchant Shipping Bill, 2024","PORTS, SHIPPING & WATERWAYS",10/12/2024,,
17,"The Coastal Shipping Bill, 2024","PORTS, SHIPPING & WATERWAYS",02/12/2024,03/04/2025,
18,"The Banking Laws (Amendment) Bill, 2024",FINANCE,09/08/2024,03/12/2024,26/03/2025
19,"The Railways (Amendment) Bill, 2024.",RAILWAYS,09/08/2024,11/12/2024,10/03/2025
20,"The Carriage of Goods by Sea Bill, 2024.","PORTS, SHIPPING & WATERWAYS",09/08/2024,28/03/2025,
21,"The Bills of Lading Bill, 2024","PORTS, SHIPPING & WATERWAYS",09/08/2024,10/03/2025,
22,"The Boilers Bill, 2024",COMMERCE AND INDUSTRY,08/08/2024,25/03/2025,04/12/2024
23,"The Waqf (Amendment) Bill, 2025",MINORITY AFFAIRS,08/08/2024,02/04/2025,03/04/2025
24,"The Mussalman Wakf (Repeal) Bill, 2025",MINORITY AFFAIRS,08/08/2024,02/04/2025,03/04/2025
25,"The Readjustment of Representation of Scheduled Tribes in Assembly Constituencies of the State of Goa Bill, 2024",LAW  AND JUSTICE,05/08/2024,,
26,"The Oilfields (Regulation and Development) Amendment Bill,2024",PETROLEUM AND NATURAL GAS,05/08/2024,12/03/2025,03/12/2024
27,"The Appropriation (No.2) Bill, 2024",FINANCE,05/08/2024,05/08/2024,08/08/2024
28,"The Disaster Management (Amendment) Bill, 2024",HOME AFFAIRS,01/08/2024,12/12/2024,25/03/2025
29,"The Bharatiya Vayuyan Vidheyak, 2024",CIVIL AVIATION,31/07/2024,09/08/2024,05/12/2024
30,"The Jammu and Kashmir Appropriation (No.3) Bill, 2024",FINANCE,30/07/2024,30/07/2024,08/08/2024
31,"The Finance (No.2) Bill, 2024",FINANCE,23/07/2024,07/08/2024,08/08/2024
32,"The Appropriation (Vote on Account) Bill, 2024",FINANCE,07/02/2024,07/02/2024,08/02/2024
33,"The Appropriation Bill, 2024",FINANCE,07/02/2024,07/02/2024,08/02/2024
34,"The Jammu and Kashmir Appropriation (No.2) Bill, 2024",FINANCE,07/02/2024,07/02/2024,08/02/2024
35,"The Jammu and Kashmir Appropriation Bill, 2024.",FINANCE,07/02/2024,07/02/2024,08/02/2024
36,"The Jammu and Kashmir Local Bodies Laws (Amendment) Bill, 2024",HOME AFFAIRS,05/02/2024,06/02/2024,09/02/2024
37,"The Public Examinations (Prevention of Unfair Means) Bill, 2024.","PERSONNEL,PUBLIC GRIEVANCES AND PENSIONS",05/02/2024,06/02/2024,09/02/2024
38,"The Water (Prevention and Control of Pollution) Amendment Bill, 2024","ENVIRONMENT, FORESTS & CLIMATE CHANGE",05/02/2024,08/02/2024,06/02/2024
39,"The Constitution (Scheduled Tribes) Order (Amendment) Bill, 2024",TRIBAL AFFAIRS,05/02/2024,08/02/2024,06/02/2024
40,"The Constitution (Scheduled Castes and Scheduled Tribes) Orders (Amendment) Bill, 2024",TRIBAL AFFAIRS,05/02/2024,08/02/2024,06/02/2024
41,"The Finance Bill, 2024",FINANCE,01/02/2024,07/02/2024,08/02/2024
42,"The Telecommunications Bill, 2023",COMMUNICATIONS & INFORMATION TECHNOLOGY,18/12/2023,20/12/2023,21/12/2023
43,"The Central Goods and Services Tax (Second Amendment) Bill, 2023",FINANCE,13/12/2023,19/12/2023,20/12/2023
44,"The Provisional Collection of Taxes Bill, 2023",FINANCE,13/12/2023,19/12/2023,20/12/2023
45,"National Capital Territory of Delhi Laws (Special Provisions) Second (Amendment) Bill, 2023",HOUSING AND URBAN AFFAIRS,13/12/2023,19/12/2023,19/12/2023
46,"The Bharatiya Nyaya (Second) Sanhita, 2023",HOME AFFAIRS,12/12/2023,20/12/2023,21/12/2023
47,"The Bharatiya Nagarik Suraksha (Second) Sanhita, 2023",HOME AFFAIRS,12/12/2023,20/12/2023,21/12/2023
48,"The Jammu and Kashmir Reorganisation (Second Amendment) Bill, 2023",HOME AFFAIRS,12/12/2023,12/12/2023,18/12/2023
49,"The Government of Union Territories (Amendment) Bill, 2023",HOME AFFAIRS,12/12/2023,12/12/2023,18/12/2023
50,"The Appropriation (No. 3) Bill, 2023",FINANCE,12/12/2023,12/12/2023,19/12/2023
51,"The Appropriation (No. 4) Bill, 2023",FINANCE,12/12/2023,12/12/2023,19/12/2023
52,"The Bharatiya Sakshya (Second) Bill, 2023",HOME AFFAIRS,12/12/2023,20/12/2023,21/12/2023
53,"The Central Universities (Amendment) Bill, 2023",EDUCATION,04/12/2023,07/12/2023,13/12/2023
54,"The Constitution (One Hundred and Twenty-Eighth Amendment)  Bill, 2023",LAW  AND JUSTICE,19/09/2023,20/09/2023,21/09/2023
55,"The Chief Election Commissioner and other Election Commissioners (Appointment Conditions of Service and Term of Office) Bill, 2023",LAW  AND JUSTICE,10/08/2023,21/12/2023,12/12/2023
56,"The Post Office Bill, 2023",COMMUNICATION,10/08/2023,18/12/2023,04/12/2023
57,"The Anusandhan National Research Foundation Bill, 2023.",SCIENCE AND TECHNOLOGY,04/08/2023,07/08/2023,09/08/2023
58,"The Pharmacy (Amendment) Bill, 2023",HEALTH AND FAMILY WELFARE,03/08/2023,07/08/2023,10/08/2023
59,"The Digital Personal Data Protection Bill, 2023",ELECTRONICS & INFORMATION TECHNOLOGY,03/08/2023,07/08/2023,09/08/2023
60,"The Government of National Capital Territory of Delhi (Amendment) Bill, 2023",HOME AFFAIRS,01/08/2023,03/08/2023,07/08/2023
61,"The Advocates (Amendment) Bill, 2023",LAW  AND JUSTICE,01/08/2023,04/12/2023,03/08/2023
62,"The Press and Registration of Periodicals Bill, 2023",INFORMATION AND BROADCASTING,01/08/2023,21/12/2023,03/08/2023
63,"The Indian Institutes of Management (Amendment) Bill, 2023",EDUCATION,28/07/2023,04/08/2023,08/08/2023
64,"The Offshore Areas Mineral (Development and Regulation) Amendment Bill, 2023",MINES,27/07/2023,01/08/2023,03/08/2023
65,"The Registration of Births and Deaths (Amendment) Bill, 2023.",HOME AFFAIRS,26/07/2023,01/08/2023,07/08/2023
66,"The Jammu and Kashmir Reservation (Amendment) Bill, 2023.",HOME AFFAIRS,26/07/2023,06/12/2023,11/12/2023
67,"The Jammu and Kashmir Reorganisation (Amendment) Bill, 2023",HOME AFFAIRS,26/07/2023,06/12/2023,11/12/2023
68,"The Constitution (Jammu and Kashmir) Scheduled Castes Order (Amendment) Bill, 2023",SOCIAL JUSTICE AND EMPOWERMENT,26/07/2023,06/02/2024,09/02/2024
69,"The Constitution (Jammu and Kashmir) Scheduled Tribes Order (Amendment) Bill, 2023",TRIBAL AFFAIRS,26/07/2023,06/02/2024,09/02/2024
70,"The Mines and Minerals (Development and Regulation) Amendment Bill, 2023",MINES,26/07/2023,28/07/2023,02/08/2023
71,"The  National Nursing and Midwifery Commission Bill, 2023",HEALTH AND FAMILY WELFARE,24/07/2023,28/07/2023,08/08/2023
72,"The National Dental Commission Bill, 2023",HEALTH AND FAMILY WELFARE,24/07/2023,28/07/2023,08/08/2023
73,"The Constitution (Scheduled Castes) Order (Amendment) Bill, 2023",SOCIAL JUSTICE AND EMPOWERMENT,24/07/2023,01/08/2023,09/08/2023
74,"The Cinematograph (Amendment) Bill, 2023",INFORMATION AND BROADCASTING,20/07/2023,31/07/2023,27/07/2023
75,"The Coastal Aquaculture Authority (Amendment) Bill, 2023","FISHERIES, ANIMAL HUSBANDRY AND DAIRYING",05/04/2023,07/08/2023,09/08/2023
76,"The Forest (Conservation) Amendment Bill, 2023","ENVIRONMENT, FORESTS & CLIMATE CHANGE",29/03/2023,26/07/2023,02/08/2023
77,"The Appropriation Bill, 2023",FINANCE,23/03/2023,23/03/2023,27/03/2023
78,"The Appropriation (No.2) Bill, 2023",FINANCE,21/03/2023,21/03/2023,27/03/2023
79,"The Jammu and Kashmir Appropriation (No.2) Bill,2023",FINANCE,21/03/2023,21/03/2023,27/03/2023
80,"The Jammu and Kashmir Appropriation Bill,2023",FINANCE,21/03/2023,21/03/2023,27/03/2023
81,"The Inter-Services Organisations (Command, Control and Discipline) Bill, 2023",DEFENCE,15/03/2023,04/08/2023,08/08/2023
82,"The Finance Bill, 2023",FINANCE,01/02/2023,24/03/2023,27/03/2023
83,"Jan Vishwas (Amendment of Provisions) Bill, 2022",COMMERCE AND INDUSTRY,22/12/2022,27/07/2023,02/08/2023
84,"The Repealing and Amending Bill, 2022",LAW  AND JUSTICE,19/12/2022,27/07/2023,13/12/2023
85,"The Appropriation (No.4) Bill, 2022",FINANCE,14/12/2022,14/12/2022,21/12/2022
86,"The Appropriation (No.5) Bill, 2022",FINANCE,14/12/2022,14/12/2022,21/12/2022
87,"The Constitution (Scheduled Tribes) Order (Fifth Amendment) Bill, 2022",TRIBAL AFFAIRS,09/12/2022,21/12/2022,25/07/2023
88,"The Constitution (Scheduled Tribes) Order (Second Amendment) Bill, 2022",TRIBAL AFFAIRS,09/12/2022,15/12/2022,22/12/2022
89,"The Constitution (Scheduled Tribes) Order (Third Amendment) Bill, 2022",TRIBAL AFFAIRS,09/12/2022,16/12/2022,26/07/2023
90,"The Constitution (Scheduled Tribes) Order (Fourth Amendment) Bill, 2022",TRIBAL AFFAIRS,09/12/2022,19/12/2022,22/12/2022
91,"The Multi-State Cooperative Societies Bill, 2023",COOPERATION,07/12/2022,25/07/2023,01/08/2023
92,"The New Delhi International Arbitration Centre (Amendment) Bill, 2022",LAW  AND JUSTICE,05/08/2022,08/08/2022,14/12/2022
93,"The Competition (Amendment) Bill, 2023",CORPORATE AFFAIRS,05/08/2022,29/03/2023,03/04/2023
94,"The Energy Conservation (Amendment) Bill, 2022",POWER,03/08/2022,08/08/2022,12/12/2022
95,"The Central Universities (Amendment) Bill, 2022",EDUCATION,01/08/2022,03/08/2022,08/08/2022
96,"The Family Courts (Amendment) Bill, 2022",LAW  AND JUSTICE,18/07/2022,26/07/2022,04/08/2022
97,"The Weapons of Mass Destruction and their Delivery Systems (Prohibition of Unlawful Activities) Amendment Bill, 2022",EXTERNAL AFFAIRS,05/04/2022,06/04/2022,01/08/2022
98,"The Indian Antarctic Bill, 2022",EARTH SCIENCES,01/04/2022,22/07/2022,01/08/2022
99,"The Constitution (Scheduled Castes and Scheduled Tribes) Orders (Second Amendment) Bill, 2022",TRIBAL AFFAIRS,28/03/2022,01/04/2022,14/12/2022
100,"The Criminal Procedure (Identification) Bill, 2022",HOME AFFAIRS,28/03/2022,04/04/2022,06/04/2022
101,"The Delhi Municipal Corporation (Amendment) Bill, 2022",HOME AFFAIRS,25/03/2022,30/03/2022,05/04/2022
102,"The Appropriation Bill, 2022",FINANCE,24/03/2022,24/03/2022,29/03/2022
103,"The Appropriation (No.2) Bill, 2022",FINANCE,14/03/2022,14/03/2022,21/03/2022
104,"The Appropriation (No.3) Bill, 2022",FINANCE,14/03/2022,14/03/2022,21/03/2022
105,"The Jammu and Kashmir Appropriation Bill, 2022",FINANCE,14/03/2022,14/03/2022,23/03/2022
106,"The Jammu and Kashmir Appropriation (No.2) Bill, 2022",FINANCE,14/03/2022,14/03/2022,23/03/2022
107,"The Constitution (Scheduled Castes and Scheduled Tribes) Orders (Amendment) Bill, 2022",TRIBAL AFFAIRS,07/02/2022,05/04/2022,30/03/2022
108,"The Constitution (Scheduled Tribes) Order (Amendment) Bill, 2022",TRIBAL AFFAIRS,07/02/2022,28/03/2022,06/04/2022
109,"The Finance Bill, 2022",FINANCE,01/02/2022,25/03/2022,29/03/2022
110,"The Election Laws (Amendment) Bill, 2021",LAW  AND JUSTICE,20/12/2021,20/12/2021,21/12/2021
111,"The Mediation Bill, 2021",LAW  AND JUSTICE,20/12/2021,07/08/2023,01/08/2023
112,"The Appropriation (No.5) Bill, 2021",FINANCE,20/12/2021,20/12/2021,
113,"The National Anti-Doping Bill, 2022",YOUTH AFFAIRS & SPORTS,17/12/2021,27/07/2022,03/08/2022
114,"The Wild Life (Protection) Amendment Bill, 2022","ENVIRONMENT, FORESTS & CLIMATE CHANGE",17/12/2021,02/08/2022,08/12/2022
115,"The Chartered Accountants, the Cost and Works Accountants and the Company Secretaries (Amendment) Bill, 2021",CORPORATE AFFAIRS,17/12/2021,30/03/2022,05/04/2022
116,"The Biological Diversity (Amendment) Bill, 2021","ENVIRONMENT, FORESTS & CLIMATE CHANGE",16/12/2021,25/07/2023,01/08/2023
117,"The Narcotic Drugs and Psychotropic Substances (Amendment) Bill, 2021",FINANCE,06/12/2021,13/12/2021,20/12/2021
118,"The Central Vigilance Commission (Amendment) Bill, 2021","PERSONNEL,PUBLIC GRIEVANCES AND PENSIONS",03/12/2021,09/12/2021,14/12/2021
119,"The Delhi Special Police Establishment (Amendment) Bill, 2021","PERSONNEL,PUBLIC GRIEVANCES AND PENSIONS",03/12/2021,09/12/2021,14/12/2021
120,"The High Court and Supreme Court Judges (Salaries and Conditions of Service) Amendment Bill, 2021",LAW  AND JUSTICE,30/11/2021,08/12/2021,13/12/2021
121,"The Farm Laws Repeal Bill, 2021",AGRICULTURE AND FARMERS WELFARE,29/11/2021,29/11/2021,29/11/2021
122,"The National Commission for Homoeopathy (Amendment) Bill, 2021","AYURVEDA, YOGA & NATUROPATHY, UNANI, SIDDHA AND HOMOEOPATHY",09/08/2021,10/08/2021,11/08/2021
123,"The National Commission for Indian System of Medicine (Amendment) Bill, 2021","AYURVEDA, YOGA & NATUROPATHY, UNANI, SIDDHA AND HOMOEOPATHY",09/08/2021,10/08/2021,11/08/2021
124,"The Constitution (One Hundred and Twenty-Seventh Amendment) Bill, 2021",SOCIAL JUSTICE AND EMPOWERMENT,09/08/2021,10/08/2021,11/08/2021
125,"The Taxation Laws (Amendment) Bill, 2021",FINANCE,05/08/2021,06/08/2021,09/08/2021
126,"The Central Universities (Amendment) Bill, 2021",EDUCATION,05/08/2021,06/08/2021,09/08/2021
127,"The Constitution (Scheduled Tribes) Order (Amendment) Bill, 2021.",TRIBAL AFFAIRS,02/08/2021,09/08/2021,05/08/2021
128,"The Tribunals Reforms Bill, 2021",FINANCE,02/08/2021,03/08/2021,09/08/2021
129,"The Commission for Air Quality Management in National Capital Region and Adjoining Areas Bill, 2021","ENVIRONMENT, FORESTS & CLIMATE CHANGE",30/07/2021,04/08/2021,05/08/2021
130,"The Limited Liability Partnership (Amendment) Bill, 2021",CORPORATE AFFAIRS,30/07/2021,09/08/2021,04/08/2021
131,"The Deposit Insurance and Credit Guarantee Corporation (Amendment) Bill, 2021",FINANCE,30/07/2021,09/08/2021,04/08/2021
132,"The General Insurance Business (Nationalisation) Amendment Bill, 2021",FINANCE,30/07/2021,02/08/2021,11/08/2021
133,"The Coconut Development Board (Amendment) Bill, 2021",AGRICULTURE AND FARMERS WELFARE,29/07/2021,04/08/2021,30/07/2021
134,"The Appropriation (No.4) Bill, 2021",FINANCE,28/07/2021,28/07/2021,
135,"The Appropriation (No.3) Bill, 2021",FINANCE,28/07/2021,28/07/2021,
136,"The Insolvency and Bankruptcy Code (Amendment) Bill,2021",FINANCE,26/07/2021,28/07/2021,03/08/2021
137,"The Inland Vessels Bill, 2021","PORTS, SHIPPING & WATERWAYS",22/07/2021,29/07/2021,02/08/2021
138,"The Essential Defence Services Bill, 2021",DEFENCE,22/07/2021,03/08/2021,05/08/2021
139,"The Airports Economic Regulatory Authority of India (Amendment) Bill, 2021.",CIVIL AVIATION,24/03/2021,29/07/2021,04/08/2021
140,"The National Bank for Financing Infrastructure and Development Bill, 2021",FINANCE,22/03/2021,23/03/2021,25/03/2021
141,"The Appropriation Bill, 2021",FINANCE,18/03/2021,18/03/2021,23/03/2021
142,"The Jammu and Kashmir Appropriation Bill, 2021",FINANCE,18/03/2021,18/03/2021,23/03/2021
143,"The Jammu and Kashmir Appropriation (No. 2) Bill, 2021",FINANCE,18/03/2021,18/03/2021,23/03/2021
144,"The Puducherry Appropriation Bill, 2021",FINANCE,18/03/2021,18/03/2021,23/03/2021
145,"The Puducherry Appropriation (Vote on Account) Bill, 2021",FINANCE,18/03/2021,18/03/2021,23/03/2021
146,"The Appropriation (No.2) Bill, 2021",FINANCE,17/03/2021,17/03/2021,23/03/2021
147,"The Insurance (Amendment) Bill, 2021",FINANCE,15/03/2021,22/03/2021,18/03/2021
148,"The Government of National Capital Territory of Delhi (Amendment) Bill, 2021.",HOME AFFAIRS,15/03/2021,22/03/2021,24/03/2021
149,"The Mines and Minerals (Development and Regulation) Amendment Bill, 2021",MINES,15/03/2021,19/03/2021,22/03/2021
150,"The National Institute of Pharmaceutical Education and Research (Amendment) Bill, 2021",CHEMICALS AND FERTILIZERS,15/03/2021,06/12/2021,09/12/2021
151,"The Juvenile Justice (Care and Protection of Children) Amendment Bill, 2021",WOMEN AND CHILD DEVELOPMENT,15/03/2021,24/03/2021,28/07/2021
152,"The Marine Aids to Navigation Bill, 2021","PORTS, SHIPPING & WATERWAYS",15/03/2021,22/03/2021,27/07/2021
153,"The Constitution (Scheduled Castes) Order (Amendment) Bill, 2021",SOCIAL JUSTICE AND EMPOWERMENT,13/02/2021,19/03/2021,22/03/2021
154,"The National Capital Territory of Delhi Laws (Special Provisions) Second (Amendment) Bill, 2021",HOUSING AND URBAN AFFAIRS,08/02/2021,10/03/2021,09/02/2021
155,"The Arbitration and Conciliation (Amendment), 2021",LAW  AND JUSTICE,04/02/2021,12/02/2021,10/03/2021
156,"THE JAMMU AND KASHMIR REORGANISATION (AMENDMENT) BILL, 2021",HOME AFFAIRS,04/02/2021,13/02/2021,08/02/2021
157,"The Finance Bill, 2021.",FINANCE,01/02/2021,23/03/2021,24/03/2021
158,"The Jammu and Kashmir Official Languages Bill, 2020",HOME AFFAIRS,22/09/2020,22/09/2020,23/09/2020
159,"The Foreign Contribution (Regulation) Amendment Bill, 2020",HOME AFFAIRS,20/09/2020,21/09/2020,23/09/2020
160,"The Occupational Safety, Health and Working Conditions Code, 2020",LABOUR AND EMPLOYMENT,19/09/2020,22/09/2020,23/09/2020
161,"The Industrial Relations Code Bill, 2020",LABOUR AND EMPLOYMENT,19/09/2020,22/09/2020,23/09/2020
162,"The Code on Social Security, 2020",LABOUR AND EMPLOYMENT,19/09/2020,22/09/2020,23/09/2020
163,"The Appropriation (No. 4) Bill, 2020",FINANCE,18/09/2020,18/09/2020,23/09/2020
164,"The Appropriation (No. 3) Bill, 2020",FINANCE,18/09/2020,18/09/2020,23/09/2020
165,"The Taxation and Other Laws (Relaxation and Amendment of Certain Provisions) Bill, 2020",FINANCE,18/09/2020,19/09/2020,22/09/2020
166,"The Insolvency and Bankruptcy Code (Second Amendment) Bill, 2020",FINANCE,15/09/2020,21/09/2020,19/09/2020
167,"The National Commission for Allied and Healthcare Professions Bill, 2020",HEALTH AND FAMILY WELFARE,15/09/2020,24/03/2021,16/03/2021
168,"The Assisted Reproductive Technology (Regulation) Bill, 2020",HEALTH AND FAMILY WELFARE,14/09/2020,01/12/2021,08/12/2021
169,"The Bilateral Netting of Qualified Financial Contracts Bill, 2020",FINANCE,14/09/2020,20/09/2020,23/09/2020
170,"The Farmers' Produce Trade and Commerce (Promotion and Facilitation) Bill, 2020",AGRICULTURE AND FARMERS WELFARE,14/09/2020,17/09/2020,20/09/2020
171,"The Farmers' (Empowerment and Protection) Agreement of Price Assurance and Farm Services Bill, 2020",AGRICULTURE AND FARMERS WELFARE,14/09/2020,17/09/2020,20/09/2020
172,"The Factoring Regulation (Amendment) Bill, 2020",FINANCE,14/09/2020,26/07/2021,29/07/2021
173,"The Banking Regulation (Amendment) Bill, 2020",FINANCE,14/09/2020,16/09/2020,22/09/2020
174,"The Salaries and Allowances of Ministers (Amendment) Bill, 2020",HOME AFFAIRS,14/09/2020,20/09/2020,18/09/2020
175,"The Epidemic Diseases (Amendment) Bill, 2020",HEALTH AND FAMILY WELFARE,14/09/2020,21/09/2020,19/09/2020
176,"The Salary, Allowances and Pension of Members of Parliament (Amendment) Bill, 2020",PARLIAMENTARY AFFAIRS,14/09/2020,15/09/2020,18/09/2020
177,"The Essential Commodities (Amendment) Bill, 2020","CONSUMER AFFAIRS ,FOOD AND PUBLIC DISTRIBUTION",14/09/2020,15/09/2020,22/09/2020
178,"The Homoeopathy Central Council (Amendment) Bill, 2020","AYURVEDA, YOGA & NATUROPATHY, UNANI, SIDDHA AND HOMOEOPATHY",14/09/2020,21/09/2020,18/09/2020
179,"The Indian Medicine Central Council (Amendment) Bill, 2020","AYURVEDA, YOGA & NATUROPATHY, UNANI, SIDDHA AND HOMOEOPATHY",14/09/2020,21/09/2020,18/09/2020
180,"The Rashtriya Raksha University Bill, 2020",HOME AFFAIRS,23/03/2020,20/09/2020,22/09/2020
181,"The National Forensic Sciences University Bill, 2020",HOME AFFAIRS,23/03/2020,20/09/2020,22/09/2020
182,"The Appropriation (No.2) Bill, 2020",FINANCE,18/03/2020,18/03/2020,23/03/2020
183,"The Jammu and Kashmir Appropriation (No.2) Bill, 2020",FINANCE,18/03/2020,18/03/2020,23/03/2020
184,"The Jammu and Kashmir Appropriation (No.4) Bill, 2020",FINANCE,18/03/2020,18/03/2020,23/03/2020
185,"The Jammu and Kashmir Appropriation (No.3) Bill, 2020",FINANCE,18/03/2020,18/03/2020,23/03/2020
186,"The Jammu and Kashmir Appropriation Bill, 2020",FINANCE,18/03/2020,18/03/2020,23/03/2020
187,"The Companies (Amendment) Bill, 2020.",CORPORATE AFFAIRS,17/03/2020,19/09/2020,22/09/2020
188,"The Appropriation Bill, 2020",FINANCE,16/03/2020,16/03/2020,23/03/2020
189,Major Port Authorities Bill 2020,SHIPPING,12/03/2020,23/09/2020,10/02/2021
190,"Indian Institutes of Information Technology Laws (Amendment) Bill, 2020",HUMAN RESOURCE DEVELOPMENT,04/03/2020,20/03/2020,22/09/2020
191,"The Medical Termination of Pregnancy (Amendment) Bill, 2020",HEALTH AND FAMILY WELFARE,02/03/2020,17/03/2020,16/03/2021
192,"The Minerals Laws (Amendment) Bill, 2020",COAL,02/03/2020,06/03/2020,12/03/2020
193,"The Institute of Teaching and Research in Ayurveda Bill, 2020.","AYURVEDA, YOGA & NATUROPATHY, UNANI, SIDDHA AND HOMOEOPATHY",10/02/2020,19/03/2020,16/09/2020
194,"The Direct Tax Vivad Se Vishwas Bill, 2020",FINANCE,05/02/2020,04/03/2020,13/03/2020
195,"The Aircraft (Amendment) Bill, 2020",CIVIL AVIATION,04/02/2020,17/03/2020,15/09/2020
196,"The Finance Bill, 2020",FINANCE,01/02/2020,23/03/2020,23/03/2020
197,"The Insolvency and Bankruptcy Code (Second Amendment) Bill, 2019",CORPORATE AFFAIRS,12/12/2019,06/03/2020,12/03/2020
198,"The Central Sanskrit University Bill, 2019",HUMAN RESOURCE DEVELOPMENT,11/12/2019,12/12/2019,16/03/2020
199,"The Constitution (One Hundred Twenty-Sixth Amendment) Bill, 2019.",LAW  AND JUSTICE,09/12/2019,10/12/2019,12/12/2019
200,"The Citizenship (Amendment) Bill, 2019",HOME AFFAIRS,09/12/2019,09/12/2019,11/12/2019
201,"The Maritime Anti-Piracy Bill, 2022",EXTERNAL AFFAIRS,09/12/2019,19/12/2022,21/12/2022
202,"The Appropriation (No. 3) Bill, 2019",FINANCE,04/12/2019,04/12/2019,12/12/2019
203,"The Arms (Amendment) Bill, 2019",HOME AFFAIRS,29/11/2019,09/12/2019,10/12/2019
204,"The National Capital Territory of Delhi (Recognition of Property Rights of Residents in Unauthorised Colonies) Bill, 2019",HOUSING AND URBAN AFFAIRS,26/11/2019,28/11/2019,04/12/2019
205,"The Dadra and Nagar Haveli and Daman and Diu (Merger of Union Territories) Bill, 2019",HOME AFFAIRS,26/11/2019,27/11/2019,03/12/2019
206,"The Taxation Laws (Amendment) Bill, 2019",FINANCE,25/11/2019,02/12/2019,05/12/2019
207,"The International Financial Services Centres Authority Bill, 2019.",FINANCE,25/11/2019,11/12/2019,12/12/2019
208,"The Recycling of Ships Bill, 2019",SHIPPING,25/11/2019,03/12/2019,09/12/2019
209,"The Special Protection Group (Amendment) Bill, 2019",HOME AFFAIRS,25/11/2019,27/11/2019,03/12/2019
210,"The Prohibition of Electronic Cigarettes (Production, Manufacture, Import, Export, Sale, Distribution, Storage and Advertisement) Bill, 2019",HEALTH AND FAMILY WELFARE,22/11/2019,27/11/2019,02/12/2019
211,"The Jammu and Kashmir Reorganisation Bill, 2019.",HOME AFFAIRS,05/08/2019,06/08/2019,05/08/2019
212,"The Supreme Court (Number of Judges) Amendment Bill, 2019",LAW  AND JUSTICE,05/08/2019,05/08/2019,07/08/2019
213,"The Chit Funds (Amendment) Bill, 2019",FINANCE,05/08/2019,20/11/2019,28/11/2019
214,"The National Institute of Design (Amendment) Bill, 2019",COMMERCE AND INDUSTRY,30/07/2019,26/11/2019,06/08/2019
215,"The Dam Safety Bill, 2019",JAL SHAKTI,29/07/2019,02/08/2019,02/12/2021
216,"The Companies (Amendment) Bill, 2019",CORPORATE AFFAIRS,25/07/2019,26/07/2019,30/07/2019
217,"The Repealing and Amending Bill, 2019",LAW  AND JUSTICE,25/07/2019,29/07/2019,02/08/2019
218,"The Insolvency and Bankruptcy Code (Amendment) Bill, 2019",CORPORATE AFFAIRS,24/07/2019,01/08/2019,29/07/2019
219,"The Codes on Wages, 2019",LABOUR AND EMPLOYMENT,23/07/2019,30/07/2019,02/08/2019
220,"The National Medical Commission Bill, 2019",HEALTH AND FAMILY WELFARE,22/07/2019,29/07/2019,01/08/2019
221,"The Transgender Persons (Protection of Rights) Bill, 2019",SOCIAL JUSTICE AND EMPOWERMENT,19/07/2019,05/08/2019,26/11/2019
222,"The Banning of Unregulated Deposit Schemes Bill, 2019",FINANCE,19/07/2019,24/07/2019,29/07/2019
223,"The Right to Information (Amendment) Bill, 2019","PERSONNEL,PUBLIC GRIEVANCES AND PENSIONS",19/07/2019,22/07/2019,25/07/2019
224,The Protection of Children from sexual Offences (Amendment) Bill 2019,WOMEN AND CHILD DEVELOPMENT,18/07/2019,01/08/2019,24/07/2019
225,"The Appropriation (No. 2) Bill, 2019",FINANCE,17/07/2019,17/07/2019,23/07/2019
226,"The Motor Vehicles (Amendment) Bill,2019",ROAD TRANSPORT & HIGHWAYS,15/07/2019,23/07/2019,31/07/2019
227,"The Surrogacy (Regulation) Bill, 2019",HEALTH AND FAMILY WELFARE,15/07/2019,05/08/2019,08/12/2021
228,"The Arbitration and Conciliation (Amendment) Bill,2019",LAW  AND JUSTICE,15/07/2019,01/08/2019,18/07/2019
229,"The Airports Economic Regulatory Authority of India (Amendment) Bill,2019",CIVIL AVIATION,12/07/2019,02/08/2019,16/07/2019
230,"The Unlawful Activities (Prevention) Amendment Bill, 2019",HOME AFFAIRS,08/07/2019,24/07/2019,02/08/2019
231,"The National Investigation Agency (Amendment) Bill, 2019",HOME AFFAIRS,08/07/2019,15/07/2019,17/07/2019
232,"The Protection of Human Rights (Amendment) Bill, 2019",HOME AFFAIRS,08/07/2019,19/07/2019,22/07/2019
233,"The Consumer Protection Bill, 2019","CONSUMER AFFAIRS ,FOOD AND PUBLIC DISTRIBUTION",08/07/2019,30/07/2019,06/08/2019
234,"The Public Premises (Eviction of Unauthorized Occupants) Amendment Bill, 2019",HOUSING AND URBAN AFFAIRS,08/07/2019,31/07/2019,06/08/2019
235,"The Jallianwala Bagh National Memorial (Amendment) Bill, 2019",CULTURE,08/07/2019,02/08/2019,19/11/2019
236,"The Central Universities (Amendment)Bill,2019",HUMAN RESOURCE DEVELOPMENT,08/07/2019,12/07/2019,16/07/2019
237,"The Finance (No. 2) Bill, 2019",FINANCE,05/07/2019,18/07/2019,23/07/2019
238,"The New Delhi International Arbitration centre Blll, 2019",LAW  AND JUSTICE,03/07/2019,10/07/2019,18/07/2019
239,"The Central Educational Institutions (Reservation in Teachers Cadre) Bill, 2019",HUMAN RESOURCE DEVELOPMENT,27/06/2019,01/07/2019,03/07/2019
