SerialNo,Title,Ministry,Introduced,Passed_LS,Passed_RS
240,"The Indian Medical Council (Amendment) Bill, 2019",HEALTH AND FAMILY WELFARE,27/06/2019,02/07/2019,04/07/2019
241,"The Dentists (Amendment) Bill, 2019",HEALTH AND FAMILY WELFARE,27/06/2019,03/07/2019,08/07/2019
242,"The Special Economic Zones (Amendment) Bill, 2019",COMMERCE AND INDUSTRY,24/06/2019,26/06/2019,27/06/2019
243,"The Jammu and Kashmir Reservation (Amendment) Bill, 2019",HOME AFFAIRS,24/06/2019,28/06/2019,01/07/2019
244,"The Aadhaar and Other Laws (Amendment) Bill, 2019",ELECTRONICS & INFORMATION TECHNOLOGY,24/06/2019,04/07/2019,08/07/2019
245,"The Muslim Women (Protection of Rights on Marriage) Bill, 2019",LAW  AND JUSTICE,21/06/2019,25/07/2019,30/07/2019
246,"The Homoeopathy Central Council (Amendment) Bill, 2019",HEALTH AND FAMILY WELFARE,21/06/2019,27/06/2019,02/07/2019
247,"The National Institute of Food Technology Entrepreneurship and Management Bill, 2019",FOOD PROCESSING INDUSTRIES,13/02/2019,26/07/2021,15/03/2021
248,"The Constitution (Scheduled Tribes) Order (Amendment) Bill, 2019.",TRIBAL AFFAIRS,09/01/2019,11/02/2020,12/12/2019
249,"The National Commission for Indian System of Medicine Bill, 2020","AYURVEDA, YOGA & NATUROPATHY, UNANI, SIDDHA AND HOMOEOPATHY",07/01/2019,14/09/2020,18/03/2020
250,"The National Commission for Homoeopathy Bill, 2020.","AYURVEDA, YOGA & NATUROPATHY, UNANI, SIDDHA AND HOMOEOPATHY",07/01/2019,14/09/2020,18/03/2020
